{
  "version": 1,
  "types": {
    "type.page": {
      "label": "안내 페이지",
      "goal": "필요한 정보를 한눈에 보여 주는 페이지",
      "screens": [
        { "name": "첫 화면", "parts": ["제목과 한 줄 소개", "지금 가장 중요한 정보", "날짜나 항목을 바꾸는 버튼"] },
        { "name": "자세히 보기", "parts": ["항목별 자세한 내용", "정보 출처와 마지막 갱신 시각"] }
      ],
      "features": [
        { "name": "핵심 정보 보여 주기", "doneWhen": "첫 화면을 열면 스크롤 없이 가장 중요한 정보가 보인다" },
        { "name": "날짜·항목 바꾸기", "doneWhen": "버튼을 누르면 내용이 그 날짜(항목)에 맞게 바뀐다" },
        { "name": "오류 안내", "doneWhen": "정보를 못 불러오면 빈 화면 대신 안내 문구가 보인다" }
      ],
      "alternative": "글과 사진만 보여 준다면 노션 페이지나 구글 사이트 도구로도 충분할 수 있어요."
    },
    "type.form": {
      "label": "신청서·설문",
      "goal": "여러 사람에게 정해진 항목을 받아 모으는 화면",
      "screens": [
        { "name": "작성 화면", "parts": ["받는 이유와 보관 기간 안내", "입력 칸", "제출 버튼"] },
        { "name": "제출 완료", "parts": ["완료 문구", "고치거나 다시 내는 방법 안내"] }
      ],
      "features": [
        { "name": "입력 확인", "doneWhen": "빈 칸이나 형식이 틀린 칸이 있으면 제출 전에 알려 준다" },
        { "name": "제출 저장", "doneWhen": "제출하면 만든 사람의 저장 공간(예: 구글 시트)에 한 줄이 생긴다" },
        { "name": "중복 확인", "doneWhen": "같은 사람이 두 번 내면 저장 공간에서 제출 시각으로 알아볼 수 있다" }
      ],
      "dataModel": [
        { "entity": "제출", "fields": ["제출 시각", "입력 항목 (꼭 필요한 것만)"] }
      ],
      "alternative": "항목만 받으면 된다면 구글 설문지나 네이버 폼으로 충분할 수 있어요. 직접 만들면 화면과 흐름을 마음대로 바꿀 수 있어요."
    },
    "type.record": {
      "label": "기록장",
      "goal": "내가 쓴 기록을 쌓고 다시 보는 앱",
      "screens": [
        { "name": "기록 목록", "parts": ["최근 기록", "검색이나 날짜 거르기"] },
        { "name": "기록 쓰기", "parts": ["입력 칸", "저장 버튼"] },
        { "name": "기록 보기", "parts": ["내용", "고치기·지우기 버튼"] }
      ],
      "features": [
        { "name": "기록 저장", "doneWhen": "저장하고 새로 고침해도 기록이 남아 있다" },
        { "name": "고치기·지우기", "doneWhen": "고친 내용이 목록에 바로 보이고, 지우기 전에 한 번 묻는다" },
        { "name": "찾기", "doneWhen": "검색어나 날짜로 원하는 기록을 찾을 수 있다" }
      ],
      "dataModel": [
        { "entity": "기록", "fields": ["작성 시각", "제목", "내용"] }
      ],
      "alternative": "메모 앱이나 스프레드시트로도 기록은 쌓을 수 있어요. 직접 만들면 내 방식에 꼭 맞출 수 있어요."
    },
    "type.quiz": {
      "label": "퀴즈",
      "goal": "문제를 풀고 바로 결과를 보는 화면",
      "screens": [
        { "name": "시작 화면", "parts": ["퀴즈 제목", "문제 수", "시작 버튼"] },
        { "name": "문제 화면", "parts": ["문제", "보기", "진행 표시"] },
        { "name": "결과 화면", "parts": ["맞힌 개수", "틀린 문제 다시 보기"] }
      ],
      "features": [
        { "name": "채점", "doneWhen": "보기를 고르면 맞았는지 틀렸는지 바로 보인다" },
        { "name": "결과 보기", "doneWhen": "마지막 문제 뒤에 맞힌 개수와 틀린 문제가 나온다" },
        { "name": "문제 바꾸기", "doneWhen": "코드를 고치지 않고 문제 목록 파일만 고쳐서 문제를 바꿀 수 있다" }
      ],
      "dataModel": [
        { "entity": "문제", "fields": ["문제", "보기", "정답", "해설"] }
      ],
      "alternative": "점수만 보면 된다면 구글 설문지의 퀴즈 기능으로도 만들 수 있어요."
    },
    "type.tool": {
      "label": "계산기·도우미",
      "goal": "한 가지 일을 빠르게 해 주는 작은 앱",
      "screens": [
        { "name": "작업 화면", "parts": ["입력", "실행 버튼", "결과"] },
        { "name": "사용법", "parts": ["한 줄 설명", "예시"] }
      ],
      "features": [
        { "name": "핵심 기능", "doneWhen": "입력하고 실행하면 결과가 1초 안에 나온다" },
        { "name": "처음으로", "doneWhen": "처음 상태로 돌리는 버튼이 있다" },
        { "name": "잘못된 입력 안내", "doneWhen": "이상한 값을 넣으면 고치는 방법을 알려 준다" }
      ]
    },
    "type.dashboard": {
      "label": "현황판·알림",
      "goal": "바뀌는 정보를 한 화면에 모아 보고, 필요하면 알림을 받는 앱",
      "screens": [
        { "name": "현황판", "parts": ["핵심 숫자", "오름·내림 표시", "마지막 갱신 시각"] },
        { "name": "설정", "parts": ["볼 항목 고르기"] }
      ],
      "features": [
        { "name": "정보 갱신", "doneWhen": "화면을 열거나 새로 고침하면 가장 최근 정보와 그 갱신 시각이 보인다" },
        { "name": "항목 고르기", "doneWhen": "볼 항목을 바꾸면 현황판이 바로 바뀐다" },
        { "name": "오류 안내", "doneWhen": "정보를 못 불러오면 브라우저에 남겨 둔 마지막 값과 함께 안내 문구가 보인다" }
      ]
    }
  },
  "slotSteps": {
    "slot.screen": { "title": "화면 뼈대 만들기", "doneWhen": "가짜 데이터로 모든 화면이 열리고, 화면 사이를 오갈 수 있다" },
    "slot.store": { "title": "저장 붙이기", "doneWhen": "입력한 내용이 새로 고침 뒤에도 남아 있다" },
    "slot.auth": {
      "title": "로그인 붙이기",
      "doneWhen": "두 계정으로 각각 로그인했을 때 서로의 기록이 보이지 않는다",
      "screen": { "name": "로그인", "parts": ["로그인 버튼", "로그아웃 버튼", "로그인 안 했을 때 안내"] }
    },
    "slot.data": { "title": "외부 데이터 붙이기", "doneWhen": "진짜 데이터가 화면에 나오고, 못 불러오면 안내 문구가 보인다" },
    "slot.notify": {
      "title": "알림 붙이기",
      "doneWhen": "조건이 맞으면 내 휴대폰으로 알림이 온다",
      "screen": { "name": "알림 설정", "parts": ["알림 받을 조건", "시험 알림 보내기 버튼"] }
    },
    "slot.host": { "title": "배포하고 공유하기", "doneWhen": "다른 기기(휴대폰)에서 주소를 열어도 모든 기능이 된다" }
  },
  "styles": {
    "style.clean": {
      "label": "깔끔하게",
      "palette": {
        "background": "#FFFFFF",
        "surface": "#F6F7F9",
        "text": "#1F2328",
        "accent": "#2563EB",
        "accentText": "#FFFFFF"
      },
      "radius": "8px",
      "fontFamily": "Pretendard",
      "baseFontSize": "16px",
      "note": "여백을 넉넉히 두고, 강조색은 한 가지만 쓴다."
    },
    "style.cute": {
      "label": "귀엽게",
      "palette": {
        "background": "#FFF8F0",
        "surface": "#FFFFFF",
        "text": "#3D2C2E",
        "accent": "#C2410C",
        "accentText": "#FFFFFF"
      },
      "radius": "16px",
      "fontFamily": "Pretendard",
      "baseFontSize": "17px",
      "note": "모서리를 크게 둥글리고, 직접 그린 작은 그림을 곁들인다."
    },
    "style.serious": {
      "label": "차분하고 믿음직하게",
      "palette": {
        "background": "#FFFFFF",
        "surface": "#F3F4F6",
        "text": "#111827",
        "accent": "#1E3A8A",
        "accentText": "#FFFFFF"
      },
      "radius": "4px",
      "fontFamily": "Pretendard",
      "baseFontSize": "16px",
      "note": "장식은 줄이고, 표와 숫자를 또렷하게 보여 준다."
    },
    "style.bold": {
      "label": "강렬하게",
      "palette": {
        "background": "#0F0F0F",
        "surface": "#1C1C1C",
        "text": "#F5F5F5",
        "accent": "#FACC15",
        "accentText": "#111111"
      },
      "radius": "12px",
      "fontFamily": "Pretendard",
      "baseFontSize": "16px",
      "note": "제목을 크게 쓰고, 강조색은 버튼과 핵심 숫자에만 쓴다."
    }
  },
  "devices": {
    "device.phone": "휴대폰 세로 화면(폭 360px)을 기준으로 만든다. 누르는 곳은 가로세로 44px 이상, 글자는 16px 이상으로 한다.",
    "device.pc": "PC 화면(폭 1280px)을 기준으로 만들되, 창을 줄여도 깨지지 않게 한다.",
    "device.both": "휴대폰 화면부터 만들고, 넓은 화면에서는 내용 폭을 720px 안쪽으로 둔다. 누르는 곳은 44px 이상으로 한다."
  },
  "audiences": { "audience.me": "나만 쓴다", "audience.few": "아는 사람 몇 명이 같이 쓴다", "audience.public": "누구나 쓴다 (인터넷에 공개)" },
  "aiTools": {
    "ai.chat-free": {
      "label": "무료 AI 채팅",
      "saveAs": "AI 채팅에 이 파일을 첨부하거나 내용을 붙여 넣으세요.",
      "packRef": "첨부한 설계도",
      "workStyle": [
        "한 번에 한 단계만 진행하고, 단계마다 바뀐 파일 전체를 보여 준다.",
        "쉬운 말로 설명하고, 낯선 용어에는 한 줄 풀이를 붙인다.",
        "모르는 것은 추측하지 말고 먼저 나에게 묻는다.",
        "단계가 끝나면 내가 직접 확인할 방법을 알려 준다.",
        "대화가 길어지면 새 대화에서 이어 갈 수 있게, 지금까지 만든 파일과 남은 단계를 정리해 준다."
      ]
    },
    "ai.chat-paid": {
      "label": "유료 AI 구독",
      "saveAs": "프로젝트(지식) 기능이 있으면 이 파일을 거기에 넣고, 없으면 채팅에 첨부하세요.",
      "packRef": "첨부한 설계도",
      "workStyle": [
        "한 번에 한 단계만 진행하고, 단계마다 바뀐 파일 전체를 보여 준다.",
        "쉬운 말로 설명하고, 낯선 용어에는 한 줄 풀이를 붙인다.",
        "모르는 것은 추측하지 말고 먼저 나에게 묻는다.",
        "단계가 끝나면 내가 직접 확인할 방법을 알려 준다.",
        "범위에 없는 기능은 만들지 않고 제안만 한다."
      ]
    },
    "ai.agent": {
      "label": "코딩 에이전트",
      "saveAs": "프로젝트 폴더에 CLAUDE.md(Claude Code) 또는 AGENTS.md(Codex 등)라는 이름으로 저장하세요.",
      "packRef": "폴더에 저장한 설계도(CLAUDE.md 또는 AGENTS.md)",
      "workStyle": [
        "한 단계씩 진행하고, 단계마다 무엇을 바꿨는지 쉬운 말로 요약한다.",
        "패키지 설치나 파일 삭제 같은 명령은 실행 전에 나에게 확인받는다.",
        "모르는 것은 추측하지 말고 먼저 나에게 묻는다.",
        "단계가 끝나면 내가 직접 확인할 방법(열어 볼 주소, 눌러 볼 버튼)을 알려 준다.",
        "범위에 없는 기능은 만들지 않고 제안만 한다."
      ]
    }
  },
  "accessLabels": { "none": "없음", "signup": "가입", "key": "키 발급", "approval": "승인 필요", "account-or-business": "계좌·사업자 필요" },
  "leadLabels": { "instant": "바로", "hours": "몇 시간", "days": "며칠" },
  "reasonLabels": {
    "domain": "분야 일치",
    "topic": "주제 일치",
    "aiTool": "고른 AI로 만들기 쉬움",
    "budget": "0원으로 시작",
    "realtime": "자주 갱신",
    "difficulty": "난이도가 알맞음",
    "official": "공식 제공",
    "access": "준비가 쉬움",
    "proxy": "키를 숨겨 줌",
    "shared": "이미 고른 도구로 해결",
    "local": "내 기기에 저장"
  },
  "conLabels": {
    "topic": "주제가 다름",
    "budget": "유료",
    "realtime": "하루 단위 데이터",
    "difficulty": "지금 수준과 난이도 차이",
    "access": "준비할 것이 있음",
    "local": "다른 사람과 같이 볼 수 없음"
  },
  "badges": {
    "free": "0원으로 시작",
    "easy": "처음 쓰기 쉬움",
    "official": "공식",
    "realtime": "실시간",
    "frequent": "자주 갱신",
    "caution": "주의: 직접 확인 필요"
  },
  "notBuildRules": [
    {
      "when": {
        "not": { "tag": "need.login", "gte": 1 }
      },
      "text": "로그인·회원가입"
    },
    {
      "when": {
        "not": { "tag": "sensitive.payment", "gte": 1 }
      },
      "text": "결제"
    },
    {
      "when": {
        "not": { "tag": "need.notify", "gte": 1 }
      },
      "text": "알림"
    },
    {
      "when": { "always": true },
      "text": "관리자 전용 화면"
    },
    {
      "when": {
        "not": { "tag": "need.save", "gte": 1 }
      },
      "text": "받은 정보를 시트나 데이터베이스에 쌓아 두는 저장 기능"
    },
    {
      "when": {
        "all": [
          { "tag": "type.form", "gte": 1 },
          {
            "not": { "tag": "need.login", "gte": 1 }
          }
        ]
      },
      "text": "제출 목록을 보여 주는 화면 (응답은 만든 사람이 저장 공간에서 직접 본다)"
    },
    {
      "when": { "tag": "type.quiz", "gte": 1 },
      "text": "순위표"
    },
    {
      "when": { "tag": "domain.finance", "gte": 1 },
      "text": "주문·자동 매매, 종목 추천"
    },
    {
      "when": { "tag": "audience.me", "gte": 1 },
      "text": "다른 사람과 공유하는 기능"
    }
  ],
  "receipt": {
    "title": "코드쇼퍼 영수증",
    "destination": "목적지",
    "unnamed": "내 앱",
    "free": "0원",
    "paid": "유료",
    "paidIncluded": "유료 포함",
    "later": "(나중)",
    "count": "{{n}}개",
    "more": "외 {{n}}개",
    "levels": { "easy": "쉬움", "normal": "보통", "hard": "어려움" },
    "timeFormat": { "minutes": "약 {{m}}분", "hours": "약 {{h}}시간", "hoursHalf": "약 {{h}}시간 30분" },
    "total": "도구 비용 합계",
    "totalFree": "0원으로 시작",